{"entity_type":"candidate_evidence","evidence_kind":"search_config","id":"candidate-evidence:search-config","payload":{"decision_id":"OD-008","decision_status":"closed","intl_segmenter":"optional_enhancement","matching":["exact_preferred","exact_alias","prefix","segmenter_token","substring"],"normalization":"unicode_nfkc_lower_diacritic_fold_whitespace_v1","popularity_or_art_value_ranking":false,"query_collection":false,"ranking_tuple":["match_class","visitor_task_entity_type","stable_id"],"remote_search":false,"segmenter_absence_preserves_complete_function":true,"semantic_search":false,"third_party_tokenizer_dependency":false},"phase_id":"MUSEUM-08","release_id":"release:art-v1-candidate-1.4.0","schema_version":"1.0.0","status":"ready"}