{"entity_type":"candidate_evidence","evidence_kind":"accessibility_summary","id":"candidate-evidence:accessibility-summary","payload":{"automated_gate":"serious_and_critical_zero","forced_colors_reduced_motion_print":true,"graph_map_text_equivalence":true,"image_alt_and_no_image_equivalence":true,"keyboard_focus_skip_live_dialogs":true,"landmarks_headings_name_role_value":true,"physical_devices":"not_available","real_assistive_technology":"not_available","route_coverage":"all_core_route_templates","zoom_200_percent_and_mobile_reflow":true},"phase_id":"MUSEUM-08","release_id":"release:art-v1-candidate-1.4.0","schema_version":"1.0.0","status":"candidate"}