{"entity_type":"candidate_evidence","evidence_kind":"content_freeze_manifest","id":"candidate-evidence:content-freeze","payload":{"approved_media_artworks":31,"artist_place_episodes":36,"artist_tours":12,"artists":12,"artworks":44,"contexts":31,"media_derivatives":242,"new_real_content_entities":0,"no_image_artworks":13,"observation_cards":44,"path_index_records":198,"places":23,"relationships_level_c":36,"thematic_tours":6,"tours_total":18},"phase_id":"MUSEUM-08","release_id":"release:art-v1-candidate-1.4.0","schema_version":"1.0.0","status":"pass"}